{
  "name": "APA",
  "description": "Taste review for the APA served in todays tasting.",
  "fields": [
    "stars",
    "text"
  ],
  "units": [
    {
      "field": "text",
      "unit": "text"
    },
    {
      "field": "stars",
      "unit": "stars"
    }
  ],
  "summary": [
    {
      "field": "stars",
      "method": "average"
    },
    {
      "field": "stars",
      "method": "latest"
    },
    {
      "field": "stars",
      "method": "last_truthy"
    },
    {
      "field": "stars",
      "method": "last_falsy"
    },
    {
      "field": "stars",
      "method": "not_supported"
    }
  ],
  "visualization": [
    {
      "field": "stars",
      "method": "doughnut"
    },
    {
      "field": "stars",
      "method": "line"
    }
  ],
  "form_submissions": true
}